{
  "tool": "ecc",
  "version": null,
  "profileId": "core",
  "target": "codex",
  "scope": null,
  "modules": [
    "agents-core",
    "platform-configs",
    "workflow-quality"
  ],
  "operations": [
    {
      "kind": "copy-path",
      "moduleId": "agents-core",
      "sourceRelativePath": ".agents",
      "destinationPath": "<HOME>/.codex/.agents",
      "strategy": "preserve-relative-path",
      "ownership": "managed",
      "scaffoldOnly": true
    },
    {
      "kind": "copy-path",
      "moduleId": "agents-core",
      "sourceRelativePath": "AGENTS.md",
      "destinationPath": "<HOME>/.codex/AGENTS.md",
      "strategy": "preserve-relative-path",
      "ownership": "managed",
      "scaffoldOnly": true
    },
    {
      "kind": "copy-path",
      "moduleId": "agents-core",
      "sourceRelativePath": "agents",
      "destinationPath": "<HOME>/.codex/agents",
      "strategy": "preserve-relative-path",
      "ownership": "managed",
      "scaffoldOnly": true
    },
    {
      "kind": "copy-path",
      "moduleId": "platform-configs",
      "sourceRelativePath": ".codex",
      "destinationPath": "<HOME>/.codex",
      "strategy": "sync-root-children",
      "ownership": "managed",
      "scaffoldOnly": true
    },
    {
      "kind": "copy-path",
      "moduleId": "platform-configs",
      "sourceRelativePath": "mcp-configs",
      "destinationPath": "<HOME>/.codex/mcp-configs",
      "strategy": "preserve-relative-path",
      "ownership": "managed",
      "scaffoldOnly": true
    },
    {
      "kind": "copy-path",
      "moduleId": "platform-configs",
      "sourceRelativePath": "scripts/auto-update.js",
      "destinationPath": "<HOME>/.codex/scripts/auto-update.js",
      "strategy": "preserve-relative-path",
      "ownership": "managed",
      "scaffoldOnly": true
    },
    {
      "kind": "copy-path",
      "moduleId": "platform-configs",
      "sourceRelativePath": "scripts/setup-package-manager.js",
      "destinationPath": "<HOME>/.codex/scripts/setup-package-manager.js",
      "strategy": "preserve-relative-path",
      "ownership": "managed",
      "scaffoldOnly": true
    },
    {
      "kind": "copy-path",
      "moduleId": "workflow-quality",
      "sourceRelativePath": "skills/agent-introspection-debugging",
      "destinationPath": "<HOME>/.codex/skills/agent-introspection-debugging",
      "strategy": "preserve-relative-path",
      "ownership": "managed",
      "scaffoldOnly": true
    },
    {
      "kind": "copy-path",
      "moduleId": "workflow-quality",
      "sourceRelativePath": "skills/agent-sort",
      "destinationPath": "<HOME>/.codex/skills/agent-sort",
      "strategy": "preserve-relative-path",
      "ownership": "managed",
      "scaffoldOnly": true
    },
    {
      "kind": "copy-path",
      "moduleId": "workflow-quality",
      "sourceRelativePath": "skills/ai-regression-testing",
      "destinationPath": "<HOME>/.codex/skills/ai-regression-testing",
      "strategy": "preserve-relative-path",
      "ownership": "managed",
      "scaffoldOnly": true
    },
    {
      "kind": "copy-path",
      "moduleId": "workflow-quality",
      "sourceRelativePath": "skills/code-tour",
      "destinationPath": "<HOME>/.codex/skills/code-tour",
      "strategy": "preserve-relative-path",
      "ownership": "managed",
      "scaffoldOnly": true
    },
    {
      "kind": "copy-path",
      "moduleId": "workflow-quality",
      "sourceRelativePath": "skills/configure-ecc",
      "destinationPath": "<HOME>/.codex/skills/configure-ecc",
      "strategy": "preserve-relative-path",
      "ownership": "managed",
      "scaffoldOnly": true
    },
    {
      "kind": "copy-path",
      "moduleId": "workflow-quality",
      "sourceRelativePath": "skills/continuous-learning",
      "destinationPath": "<HOME>/.codex/skills/continuous-learning",
      "strategy": "preserve-relative-path",
      "ownership": "managed",
      "scaffoldOnly": true
    },
    {
      "kind": "copy-path",
      "moduleId": "workflow-quality",
      "sourceRelativePath": "skills/continuous-learning-v2",
      "destinationPath": "<HOME>/.codex/skills/continuous-learning-v2",
      "strategy": "preserve-relative-path",
      "ownership": "managed",
      "scaffoldOnly": true
    },
    {
      "kind": "copy-path",
      "moduleId": "workflow-quality",
      "sourceRelativePath": "skills/council",
      "destinationPath": "<HOME>/.codex/skills/council",
      "strategy": "preserve-relative-path",
      "ownership": "managed",
      "scaffoldOnly": true
    },
    {
      "kind": "copy-path",
      "moduleId": "workflow-quality",
      "sourceRelativePath": "skills/e2e-testing",
      "destinationPath": "<HOME>/.codex/skills/e2e-testing",
      "strategy": "preserve-relative-path",
      "ownership": "managed",
      "scaffoldOnly": true
    },
    {
      "kind": "copy-path",
      "moduleId": "workflow-quality",
      "sourceRelativePath": "skills/error-handling",
      "destinationPath": "<HOME>/.codex/skills/error-handling",
      "strategy": "preserve-relative-path",
      "ownership": "managed",
      "scaffoldOnly": true
    },
    {
      "kind": "copy-path",
      "moduleId": "workflow-quality",
      "sourceRelativePath": "skills/eval-harness",
      "destinationPath": "<HOME>/.codex/skills/eval-harness",
      "strategy": "preserve-relative-path",
      "ownership": "managed",
      "scaffoldOnly": true
    },
    {
      "kind": "copy-path",
      "moduleId": "workflow-quality",
      "sourceRelativePath": "skills/hookify-rules",
      "destinationPath": "<HOME>/.codex/skills/hookify-rules",
      "strategy": "preserve-relative-path",
      "ownership": "managed",
      "scaffoldOnly": true
    },
    {
      "kind": "copy-path",
      "moduleId": "workflow-quality",
      "sourceRelativePath": "skills/iterative-retrieval",
      "destinationPath": "<HOME>/.codex/skills/iterative-retrieval",
      "strategy": "preserve-relative-path",
      "ownership": "managed",
      "scaffoldOnly": true
    },
    {
      "kind": "copy-path",
      "moduleId": "workflow-quality",
      "sourceRelativePath": "skills/plankton-code-quality",
      "destinationPath": "<HOME>/.codex/skills/plankton-code-quality",
      "strategy": "preserve-relative-path",
      "ownership": "managed",
      "scaffoldOnly": true
    },
    {
      "kind": "copy-path",
      "moduleId": "workflow-quality",
      "sourceRelativePath": "skills/production-audit",
      "destinationPath": "<HOME>/.codex/skills/production-audit",
      "strategy": "preserve-relative-path",
      "ownership": "managed",
      "scaffoldOnly": true
    },
    {
      "kind": "copy-path",
      "moduleId": "workflow-quality",
      "sourceRelativePath": "skills/skill-scout",
      "destinationPath": "<HOME>/.codex/skills/skill-scout",
      "strategy": "preserve-relative-path",
      "ownership": "managed",
      "scaffoldOnly": true
    },
    {
      "kind": "copy-path",
      "moduleId": "workflow-quality",
      "sourceRelativePath": "skills/skill-stocktake",
      "destinationPath": "<HOME>/.codex/skills/skill-stocktake",
      "strategy": "preserve-relative-path",
      "ownership": "managed",
      "scaffoldOnly": true
    },
    {
      "kind": "copy-path",
      "moduleId": "workflow-quality",
      "sourceRelativePath": "skills/strategic-compact",
      "destinationPath": "<HOME>/.codex/skills/strategic-compact",
      "strategy": "preserve-relative-path",
      "ownership": "managed",
      "scaffoldOnly": true
    },
    {
      "kind": "copy-path",
      "moduleId": "workflow-quality",
      "sourceRelativePath": "skills/tdd-workflow",
      "destinationPath": "<HOME>/.codex/skills/tdd-workflow",
      "strategy": "preserve-relative-path",
      "ownership": "managed",
      "scaffoldOnly": true
    },
    {
      "kind": "copy-path",
      "moduleId": "workflow-quality",
      "sourceRelativePath": "skills/verification-loop",
      "destinationPath": "<HOME>/.codex/skills/verification-loop",
      "strategy": "preserve-relative-path",
      "ownership": "managed",
      "scaffoldOnly": true
    },
    {
      "kind": "copy-path",
      "moduleId": "workflow-quality",
      "sourceRelativePath": "skills/windows-desktop-e2e",
      "destinationPath": "<HOME>/.codex/skills/windows-desktop-e2e",
      "strategy": "preserve-relative-path",
      "ownership": "managed",
      "scaffoldOnly": true
    }
  ],
  "conflicts": [],
  "warnings": [],
  "safety": {
    "dryRunRequired": true,
    "globalInstallAllowed": true,
    "mcpAllowed": false,
    "allDestinationsInsideAllowedRoots": true
  }
}
